hotel_name,location,GPS,link,rating,rating_desc,reviews,description
Résidence Prestige Odalys Front de Neige,Plagne Villages,"6.68728351593018,45.5050705206003",booking.com//hotel/fr/residence-prestige-odalys-front-de-neige.fr.html?label=gen173nr-1BCAEoggI46AdIM1gEaLUBiAEBmAENuAEXyAEM2AEB6AEBiAIBqAIDuALDxM2KBsACAdICJGMxZDE4N2EwLTZlNmEtNDdiOS1hMDUyLTExMTM4YjkwMjQ5MtgCBeACAQ&sid=b02793c5fabe389a7569f9a4b9c90e8c&dest_id=73&dest_type=country&group_adults=2&group_children=0&hapos=248&hpos=23&no_rooms=1&sr_order=popularity&srepoch=1632872041&srpvid=d773a5b3a9ab00a2&ucfs=1&from=searchresults,"8,3",Très bien,228 expériences vécues,"La Résidence Prestige Odalys Front de Neige est située à Plagne Villages, en Auvergne-Rhône-Alpes, à proximité de l’école de ski de La Plagne Centre et des remontées mécaniques."
Hôtel La Crèche,La Chomette,"3.47291886806488,45.2312630688456",booking.com//hotel/fr/logis-la-creche.fr.html?label=gen173nr-1BCAEoggI46AdIM1gEaLUBiAEBmAENuAEXyAEM2AEB6AEBiAIBqAIDuALDxM2KBsACAdICJGMxZDE4N2EwLTZlNmEtNDdiOS1hMDUyLTExMTM4YjkwMjQ5MtgCBeACAQ&sid=b02793c5fabe389a7569f9a4b9c90e8c&dest_id=73&dest_type=country&group_adults=2&group_children=0&hapos=249&hpos=24&no_rooms=1&sr_order=popularity&srepoch=1632872041&srpvid=d773a5b3a9ab00a2&ucfs=1&from=searchresults,"8,3",Très bien,94 expériences vécues,"Le Logis La Crèche est idéalement situé au cœur de l'Auvergne, dans la campagne entre Clermont Ferrand et Le Puy en Velay. Il offre un accueil chaleureux et convivial."
La KEFOISE,Fouquières-lès-Lens,"2.902139,50.43652",booking.com//hotel/fr/la-kefoise.fr.html?label=gen173nr-1BCAEoggI46AdIM1gEaLUBiAEBmAENuAEXyAEM2AEB6AEBiAIBqAIDuALDxM2KBsACAdICJGMxZDE4N2EwLTZlNmEtNDdiOS1hMDUyLTExMTM4YjkwMjQ5MtgCBeACAQ&sid=b02793c5fabe389a7569f9a4b9c90e8c&dest_id=73&dest_type=country&group_adults=2&group_children=0&hapos=250&hpos=25&no_rooms=1&sr_order=popularity&srepoch=1632872041&srpvid=d773a5b3a9ab00a2&ucfs=1&from=searchresults,"9,4",Fabuleux,98 expériences vécues,"Situé à Fouquières-lès-Lens, l'établissement La KEFOISE dispose d'un restaurant, d'un salon commun, d'un jardin et d'une connexion Wi-Fi gratuite."
B.V.CO DOMAINE DE DUGNY,Onzain,"1.18824,47.524851",booking.com//hotel/fr/domaine-de-dugny-onzain12345678.fr.html?label=gen173nr-1BCAEoggI46AdIM1gEaLUBiAEBmAENuAEXyAEM2AEB6AEBiAIBqAIDuALDxM2KBsACAdICJGMxZDE4N2EwLTZlNmEtNDdiOS1hMDUyLTExMTM4YjkwMjQ5MtgCBeACAQ&sid=61b454cb8fd41d94843e993cf7cd7bd2&dest_id=73&dest_type=country&group_adults=2&group_children=0&hapos=251&hpos=1&no_rooms=1&sr_order=popularity&srepoch=1632872044&srpvid=c37ba5b577a20096&ucfs=1&from=searchresults,"8,5",Très bien,67 expériences vécues,"Doté d'une aire de jeux pour enfants, le DOMAINE DE DUGNY propose des hébergements à Onzain."
Lagrange Vacances Le Village de la Mer,Talmont-Saint-Hilaire,"-1.6944694519043,46.4718978482246",booking.com//hotel/fr/residence-le-village-de-la-mer-lagrange-confort-kid.fr.html?label=gen173nr-1BCAEoggI46AdIM1gEaLUBiAEBmAENuAEXyAEM2AEB6AEBiAIBqAIDuALDxM2KBsACAdICJGMxZDE4N2EwLTZlNmEtNDdiOS1hMDUyLTExMTM4YjkwMjQ5MtgCBeACAQ&sid=61b454cb8fd41d94843e993cf7cd7bd2&dest_id=73&dest_type=country&group_adults=2&group_children=0&hapos=252&hpos=2&no_rooms=1&sr_order=popularity&srepoch=1632872044&srpvid=c37ba5b577a20096&ucfs=1&from=searchresults,"8,0",Très bien,105 expériences vécues,"Le Lagrange Vacances Le Village de la Mer vous accueille à 3,5 km de la côte, dans la campagne vendéenne. Il dispose d'une piscine extérieure et d'un court de tennis."
Campanile Lorient - Lanester,Lanester,"-3.35048139095306,47.7780437163863",booking.com//hotel/fr/campanile-lorient-lanester.fr.html?label=gen173nr-1BCAEoggI46AdIM1gEaLUBiAEBmAENuAEXyAEM2AEB6AEBiAIBqAIDuALDxM2KBsACAdICJGMxZDE4N2EwLTZlNmEtNDdiOS1hMDUyLTExMTM4YjkwMjQ5MtgCBeACAQ&sid=61b454cb8fd41d94843e993cf7cd7bd2&dest_id=73&dest_type=country&group_adults=2&group_children=0&hapos=253&hpos=3&no_rooms=1&sr_order=popularity&srepoch=1632872044&srpvid=c37ba5b577a20096&ucfs=1&from=searchresults,"7,3",Bien,530 expériences vécues,"Situé à Lanester, à 400 mètres du parc des expositions de Lorient, le Campanile Lorient - Lanester propose un restaurant, un parking privé gratuit et un bar."
Logis Auberge de l'Isard,Saint-Lary,"0.893786500000033,42.930451",booking.com//hotel/fr/logis-auberge-de-l-isard.fr.html?label=gen173nr-1BCAEoggI46AdIM1gEaLUBiAEBmAENuAEXyAEM2AEB6AEBiAIBqAIDuALDxM2KBsACAdICJGMxZDE4N2EwLTZlNmEtNDdiOS1hMDUyLTExMTM4YjkwMjQ5MtgCBeACAQ&sid=61b454cb8fd41d94843e993cf7cd7bd2&dest_id=73&dest_type=country&group_adults=2&group_children=0&hapos=254&hpos=4&no_rooms=1&sr_order=popularity&srepoch=1632872044&srpvid=c37ba5b577a20096&ucfs=1&from=searchresults,"8,0",Très bien,78 expériences vécues,"Le Logis Auberge De L'isard est situé dans l'Ariège, au cœur du village de St Lary. Son restaurant sert une cuisine traditionnelle préparée avec des produits locaux."
Hôtel Bel'Air,Jausiers,"6.72858148813248,44.4138577650145",booking.com//hotel/fr/bel-air.fr.html?label=gen173nr-1BCAEoggI46AdIM1gEaLUBiAEBmAENuAEXyAEM2AEB6AEBiAIBqAIDuALDxM2KBsACAdICJGMxZDE4N2EwLTZlNmEtNDdiOS1hMDUyLTExMTM4YjkwMjQ5MtgCBeACAQ&sid=61b454cb8fd41d94843e993cf7cd7bd2&dest_id=73&dest_type=country&group_adults=2&group_children=0&hapos=255&hpos=5&no_rooms=1&sr_order=popularity&srepoch=1632872044&srpvid=c37ba5b577a20096&ucfs=1&from=searchresults,"7,9",Bien,487 expériences vécues,"Situé à Jausiers, l'établissement 2 étoiles Hôtel Bel Air dispose d'un restaurant, d'un bar, d'un salon commun, d’un local à skis et d'un jardin."
Le Riviera,Appietto,"8.77464830875397,41.9863588394794",booking.com//hotel/fr/le-riviera.fr.html?label=gen173nr-1BCAEoggI46AdIM1gEaLUBiAEBmAENuAEXyAEM2AEB6AEBiAIBqAIDuALDxM2KBsACAdICJGMxZDE4N2EwLTZlNmEtNDdiOS1hMDUyLTExMTM4YjkwMjQ5MtgCBeACAQ&sid=61b454cb8fd41d94843e993cf7cd7bd2&dest_id=73&dest_type=country&group_adults=2&group_children=0&hapos=256&hpos=6&no_rooms=1&sr_order=popularity&srepoch=1632872044&srpvid=c37ba5b577a20096&ucfs=1&from=searchresults,"6,7",Note,508 expériences vécues,"Situé à flanc de coteau, l'hôtel Le Riviera se trouve à seulement 10 km d'Ajaccio dans l'ouest de la Corse."
Les Belles Terrasses,Tourrettes-sur-Loup,"7.07288928329945,43.7187688828743",booking.com//hotel/fr/les-belles-terrasses.fr.html?label=gen173nr-1BCAEoggI46AdIM1gEaLUBiAEBmAENuAEXyAEM2AEB6AEBiAIBqAIDuALDxM2KBsACAdICJGMxZDE4N2EwLTZlNmEtNDdiOS1hMDUyLTExMTM4YjkwMjQ5MtgCBeACAQ&sid=61b454cb8fd41d94843e993cf7cd7bd2&dest_id=73&dest_type=country&group_adults=2&group_children=0&hapos=257&hpos=7&no_rooms=1&sr_order=popularity&srepoch=1632872044&srpvid=c37ba5b577a20096&ucfs=1&from=searchresults,"8,2",Très bien,473 expériences vécues,"Installé à Tourrettes-sur-Loup, à 15 km de la plage, l’établissement à la gestion familiale Les Belles Terrasses vous propose un jardin, une connexion Wi-Fi gratuite et des hébergements offrant une..."
Le Square,Astaffort,"0.650718,44.063949",booking.com//hotel/fr/le-square-astaffort1.fr.html?label=gen173nr-1BCAEoggI46AdIM1gEaLUBiAEBmAENuAEXyAEM2AEB6AEBiAIBqAIDuALDxM2KBsACAdICJGMxZDE4N2EwLTZlNmEtNDdiOS1hMDUyLTExMTM4YjkwMjQ5MtgCBeACAQ&sid=61b454cb8fd41d94843e993cf7cd7bd2&dest_id=73&dest_type=country&group_adults=2&group_children=0&hapos=258&hpos=8&no_rooms=1&sr_order=popularity&srepoch=1632872044&srpvid=c37ba5b577a20096&ucfs=1&from=searchresults,"9,2",Fabuleux,87 expériences vécues,"Situé à Astaffort, l'établissement Le Square dispose d'un bar et d'une terrasse."
"La Ferme Blanche, The Originals Relais (Relais du Silence)",Lompret,"3.00410399999998,50.654111",booking.com//hotel/fr/ferme-blanche.fr.html?label=gen173nr-1BCAEoggI46AdIM1gEaLUBiAEBmAENuAEXyAEM2AEB6AEBiAIBqAIDuALDxM2KBsACAdICJGMxZDE4N2EwLTZlNmEtNDdiOS1hMDUyLTExMTM4YjkwMjQ5MtgCBeACAQ&sid=61b454cb8fd41d94843e993cf7cd7bd2&dest_id=73&dest_type=country&group_adults=2&group_children=0&hapos=259&hpos=9&no_rooms=1&sr_order=popularity&srepoch=1632872044&srpvid=c37ba5b577a20096&ucfs=1&from=searchresults,"7,9",Bien,153 expériences vécues,"Dotée d’un restaurant et d’un parking gratuit, La Ferme Blanche, The Originals Relais (Relais du Silence) propose des hébergements paisibles dans une ferme du XVIIIe siècle située à la campagne, à 10..."
Contact Hôtel Fontenay le Comte,Fontenay-le-Comte,"-0.813927054405212,46.4472460594093",booking.com//hotel/fr/auberge-everhotel-fontenay-le-comte.fr.html?label=gen173nr-1BCAEoggI46AdIM1gEaLUBiAEBmAENuAEXyAEM2AEB6AEBiAIBqAIDuALDxM2KBsACAdICJGMxZDE4N2EwLTZlNmEtNDdiOS1hMDUyLTExMTM4YjkwMjQ5MtgCBeACAQ&sid=61b454cb8fd41d94843e993cf7cd7bd2&dest_id=73&dest_type=country&group_adults=2&group_children=0&hapos=260&hpos=10&no_rooms=1&sr_order=popularity&srepoch=1632872044&srpvid=c37ba5b577a20096&ucfs=1&from=searchresults,"7,8",Bien,730 expériences vécues,"Le Contact Hôtel Fontenay le Comte est situé à proximité de l'autoroute A83 et à 2,5 km du centre de Fontenay-le-Comte, en Vendée."
Le Nouveau Monde,Breuillet,"2.19363680000004,48.5777125",booking.com//hotel/fr/le-nouveau-monde-breuillet.fr.html?label=gen173nr-1BCAEoggI46AdIM1gEaLUBiAEBmAENuAEXyAEM2AEB6AEBiAIBqAIDuALDxM2KBsACAdICJGMxZDE4N2EwLTZlNmEtNDdiOS1hMDUyLTExMTM4YjkwMjQ5MtgCBeACAQ&sid=61b454cb8fd41d94843e993cf7cd7bd2&dest_id=73&dest_type=country&group_adults=2&group_children=0&hapos=261&hpos=11&no_rooms=1&sr_order=popularity&srepoch=1632872044&srpvid=c37ba5b577a20096&ucfs=1&from=searchresults,"7,9",Bien,110 expériences vécues,"Situé à Breuillet, l'établissement Le Nouveau Monde propose un bar, un salon commun, un jardin et une connexion Wi-Fi gratuite dans l'ensemble de ses locaux."
Hôtel de La Vallée,Ornans,"6.14203870296478,47.1067414323701",booking.com//hotel/fr/de-la-valla-c-e-ornans.fr.html?label=gen173nr-1BCAEoggI46AdIM1gEaLUBiAEBmAENuAEXyAEM2AEB6AEBiAIBqAIDuALDxM2KBsACAdICJGMxZDE4N2EwLTZlNmEtNDdiOS1hMDUyLTExMTM4YjkwMjQ5MtgCBeACAQ&sid=61b454cb8fd41d94843e993cf7cd7bd2&dest_id=73&dest_type=country&group_adults=2&group_children=0&hapos=262&hpos=12&no_rooms=1&sr_order=popularity&srepoch=1632872044&srpvid=c37ba5b577a20096&ucfs=1&from=searchresults,"8,3",Très bien,506 expériences vécues,"Situé à Ornans, l'Hôtel de La Vallée se trouve à seulement 200 mètres du centre-ville et de la Loue. Le musée Gustave Courbet est installé à tout juste 550 mètres."
Eden marine,Montalieu-Vercieu,"5.4218846506003,45.8257383145554",booking.com//hotel/fr/eden-marine.fr.html?label=gen173nr-1BCAEoggI46AdIM1gEaLUBiAEBmAENuAEXyAEM2AEB6AEBiAIBqAIDuALDxM2KBsACAdICJGMxZDE4N2EwLTZlNmEtNDdiOS1hMDUyLTExMTM4YjkwMjQ5MtgCBeACAQ&sid=61b454cb8fd41d94843e993cf7cd7bd2&dest_id=73&dest_type=country&group_adults=2&group_children=0&hapos=263&hpos=13&no_rooms=1&sr_order=popularity&srepoch=1632872044&srpvid=c37ba5b577a20096&ucfs=1&from=searchresults,"8,9",Superbe,46 expériences vécues,"Situé dans le port du Rhône à Montalieu-Vercieu, l'Eden marine propose un hébergement en bateau avec connexion Wi-Fi gratuite."
Best Western Le Relais de Laguiole Hôtel & Spa,Laguiole,"2.85150468349457,44.6837224233066",booking.com//hotel/fr/best-western-le-relais-delaguiole.fr.html?label=gen173nr-1BCAEoggI46AdIM1gEaLUBiAEBmAENuAEXyAEM2AEB6AEBiAIBqAIDuALDxM2KBsACAdICJGMxZDE4N2EwLTZlNmEtNDdiOS1hMDUyLTExMTM4YjkwMjQ5MtgCBeACAQ&sid=61b454cb8fd41d94843e993cf7cd7bd2&dest_id=73&dest_type=country&group_adults=2&group_children=0&hapos=264&hpos=14&no_rooms=1&sr_order=popularity&srepoch=1632872044&srpvid=c37ba5b577a20096&ucfs=1&from=searchresults,"8,8",Superbe,556 expériences vécues,"Le Best Western Le Relais De Laguiole est situé à Laguiole, à seulement 15 km du chemin de Saint-Jacques-de-Compostelle. L'hôtel propose des chambres très confortables et entièrement équipées."
Comfort Hotel Pithiviers,Pithiviers,"2.25647673010826,48.1804416234965",booking.com//hotel/fr/comfort-hotel-pithiviers.fr.html?label=gen173nr-1BCAEoggI46AdIM1gEaLUBiAEBmAENuAEXyAEM2AEB6AEBiAIBqAIDuALDxM2KBsACAdICJGMxZDE4N2EwLTZlNmEtNDdiOS1hMDUyLTExMTM4YjkwMjQ5MtgCBeACAQ&sid=61b454cb8fd41d94843e993cf7cd7bd2&dest_id=73&dest_type=country&group_adults=2&group_children=0&hapos=265&hpos=15&no_rooms=1&sr_order=popularity&srepoch=1632872044&srpvid=c37ba5b577a20096&ucfs=1&from=searchresults,"7,1",Bien,408 expériences vécues,"Niché au cœur d'un écrin de verdure, le Comfort Hotel Pithiviers est situé à Pithiviers, à 20 minutes de marche du château de Bellecour."
B&B Hotel ANNEMASSE Saint-Cergues,Saint-Cergues,"6.31118099953073,46.2230616455215",booking.com//hotel/fr/b-b-annemasse-saint-cergues.fr.html?label=gen173nr-1BCAEoggI46AdIM1gEaLUBiAEBmAENuAEXyAEM2AEB6AEBiAIBqAIDuALDxM2KBsACAdICJGMxZDE4N2EwLTZlNmEtNDdiOS1hMDUyLTExMTM4YjkwMjQ5MtgCBeACAQ&sid=61b454cb8fd41d94843e993cf7cd7bd2&dest_id=73&dest_type=country&group_adults=2&group_children=0&hapos=266&hpos=16&no_rooms=1&sr_order=popularity&srepoch=1632872044&srpvid=c37ba5b577a20096&ucfs=1&from=searchresults,"8,3",Très bien,1 221 expériences vécues,"Le B&B Hotel ANNEMASSE Saint-Cergues occupe un bâtiment datant de 2018, à Saint-Cergues. Il vous propose des chambres équipées d’une connexion Wi-Fi gratuite et d’une télévision par câble à écran..."
The Originals Boutique Hôtel Spa Beuzeville Honfleur Sud,Beuzeville,"0.35881519317627,49.3396087126146",booking.com//hotel/fr/best-beuzeville-honfleur.fr.html?label=gen173nr-1BCAEoggI46AdIM1gEaLUBiAEBmAENuAEXyAEM2AEB6AEBiAIBqAIDuALDxM2KBsACAdICJGMxZDE4N2EwLTZlNmEtNDdiOS1hMDUyLTExMTM4YjkwMjQ5MtgCBeACAQ&sid=61b454cb8fd41d94843e993cf7cd7bd2&dest_id=73&dest_type=country&group_adults=2&group_children=0&hapos=267&hpos=17&no_rooms=1&sr_order=popularity&srepoch=1632872044&srpvid=c37ba5b577a20096&ucfs=1&from=searchresults,"7,3",Bien,801 expériences vécues,"Situé dans un cadre paisible et verdoyant, près de la ville pittoresque de Honfleur, l'établissement The Originals Boutique Hôtel Spa Beuzeville Honfleur Sud propose un centre de bien-être et une..."
Hotel De L'Arrivée,Guingamp,"-3.14345240592957,48.5562217659786",booking.com//hotel/fr/inter-de-l-arrivee.fr.html?label=gen173nr-1BCAEoggI46AdIM1gEaLUBiAEBmAENuAEXyAEM2AEB6AEBiAIBqAIDuALDxM2KBsACAdICJGMxZDE4N2EwLTZlNmEtNDdiOS1hMDUyLTExMTM4YjkwMjQ5MtgCBeACAQ&sid=61b454cb8fd41d94843e993cf7cd7bd2&dest_id=73&dest_type=country&group_adults=2&group_children=0&hapos=268&hpos=18&no_rooms=1&sr_order=popularity&srepoch=1632872044&srpvid=c37ba5b577a20096&ucfs=1&from=searchresults,"7,2",Bien,352 expériences vécues,"L'Hotel De L'Arrivée bénéficie d'un emplacement idéal en face de la gare de Guingamp, à seulement 5 minutes à pied du centre-ville."
Hôtel Le Saint Amand,Saint-Amand-Montrond,"2.50103116035461,46.7250688188061",booking.com//hotel/fr/hotel-le-saint-amand.fr.html?label=gen173nr-1BCAEoggI46AdIM1gEaLUBiAEBmAENuAEXyAEM2AEB6AEBiAIBqAIDuALDxM2KBsACAdICJGMxZDE4N2EwLTZlNmEtNDdiOS1hMDUyLTExMTM4YjkwMjQ5MtgCBeACAQ&sid=61b454cb8fd41d94843e993cf7cd7bd2&dest_id=73&dest_type=country&group_adults=2&group_children=0&hapos=269&hpos=19&no_rooms=1&sr_order=popularity&srepoch=1632872044&srpvid=c37ba5b577a20096&ucfs=1&from=searchresults,"7,3",Bien,215 expériences vécues,"L'Hôtel Le Saint Amand, établissement 2 étoiles, se trouve à 5 minutes en voiture de l'autoroute A71, qui mène directement à Clermont-Ferrand et Montpellier."
Hotel Restaurant Le Clos,Besse-et-Saint-Anastaise,"2.92759090662003,45.5153578125523",booking.com//hotel/fr/restaurant-le-clos-besse-et-saint-anastaise.fr.html?label=gen173nr-1BCAEoggI46AdIM1gEaLUBiAEBmAENuAEXyAEM2AEB6AEBiAIBqAIDuALDxM2KBsACAdICJGMxZDE4N2EwLTZlNmEtNDdiOS1hMDUyLTExMTM4YjkwMjQ5MtgCBeACAQ&sid=61b454cb8fd41d94843e993cf7cd7bd2&dest_id=73&dest_type=country&group_adults=2&group_children=0&hapos=270&hpos=20&no_rooms=1&sr_order=popularity&srepoch=1632872044&srpvid=c37ba5b577a20096&ucfs=1&from=searchresults,"7,7",Bien,419 expériences vécues,"Situé dans le village médiéval de Besse-et-Saint-Anastaise, à 500 mètres du centre, l'Hotel Restaurant Le Clos vous accueille à seulement 6 km de la station de sports d'hiver et d'été de Super-Besse."
Hôtel & Gastronomie - La Table de l'Europe,Villeréal,"0.744136,44.636976",booking.com//hotel/fr/de-l-39-europe-villereal.fr.html?label=gen173nr-1BCAEoggI46AdIM1gEaLUBiAEBmAENuAEXyAEM2AEB6AEBiAIBqAIDuALDxM2KBsACAdICJGMxZDE4N2EwLTZlNmEtNDdiOS1hMDUyLTExMTM4YjkwMjQ5MtgCBeACAQ&sid=61b454cb8fd41d94843e993cf7cd7bd2&dest_id=73&dest_type=country&group_adults=2&group_children=0&hapos=271&hpos=21&no_rooms=1&sr_order=popularity&srepoch=1632872044&srpvid=c37ba5b577a20096&ucfs=1&from=searchresults,"8,8",Superbe,102 expériences vécues,"Situé à Villeréal, l'Hôtel & Gastronomie - La Table de l'Europe propose un restaurant, un bar, un jardin et une connexion Wi-Fi gratuite dans l'ensemble de ses locaux."
Hôtel Restaurant La Caravelle,Sari-Solenzara,"9.39697980880737,41.8591737607",booking.com//hotel/fr/la-caravelle-sari-solenzara.fr.html?label=gen173nr-1BCAEoggI46AdIM1gEaLUBiAEBmAENuAEXyAEM2AEB6AEBiAIBqAIDuALDxM2KBsACAdICJGMxZDE4N2EwLTZlNmEtNDdiOS1hMDUyLTExMTM4YjkwMjQ5MtgCBeACAQ&sid=61b454cb8fd41d94843e993cf7cd7bd2&dest_id=73&dest_type=country&group_adults=2&group_children=0&hapos=272&hpos=22&no_rooms=1&sr_order=popularity&srepoch=1632872044&srpvid=c37ba5b577a20096&ucfs=1&from=searchresults,"7,6",Bien,324 expériences vécues,"Situé sur la côte est de la Corse, l'Hôtel Restaurant La Caravelle vous accueille à 2 minutes à pied du centre de Solenzara et à 550 mètres du port de la ville."
Hôtel le Roudou,Fouesnant,"-4.01875649451222,47.9000376317381",booking.com//hotel/fr/ha-tel-le-roudou.fr.html?label=gen173nr-1BCAEoggI46AdIM1gEaLUBiAEBmAENuAEXyAEM2AEB6AEBiAIBqAIDuALDxM2KBsACAdICJGMxZDE4N2EwLTZlNmEtNDdiOS1hMDUyLTExMTM4YjkwMjQ5MtgCBeACAQ&sid=61b454cb8fd41d94843e993cf7cd7bd2&dest_id=73&dest_type=country&group_adults=2&group_children=0&hapos=273&hpos=23&no_rooms=1&sr_order=popularity&srepoch=1632872044&srpvid=c37ba5b577a20096&ucfs=1&from=searchresults,"8,2",Très bien,265 expériences vécues,"Situé à Fouesnant, en Bretagne, dans le Finistère, à seulement 3 km des plages de sable fin et à 13 km de Quimper, l'Hôtel le Roudou propose un jardin et une connexion Wi-Fi gratuite."
La Croix Blanche,Montrichard,"1.18554711341858,47.3428958463355",booking.com//hotel/fr/la-croix-blanche-montrichard.fr.html?label=gen173nr-1BCAEoggI46AdIM1gEaLUBiAEBmAENuAEXyAEM2AEB6AEBiAIBqAIDuALDxM2KBsACAdICJGMxZDE4N2EwLTZlNmEtNDdiOS1hMDUyLTExMTM4YjkwMjQ5MtgCBeACAQ&sid=61b454cb8fd41d94843e993cf7cd7bd2&dest_id=73&dest_type=country&group_adults=2&group_children=0&hapos=274&hpos=24&no_rooms=1&sr_order=popularity&srepoch=1632872044&srpvid=c37ba5b577a20096&ucfs=1&from=searchresults,"7,0",Bien,527 expériences vécues,"Cet hôtel occupe un bâtiment du XVIe siècle situé à moins de 200 mètres de la rivière Le Cher. Il possède des chambres avec salle de bains, un restaurant et une connexion Wi-Fi gratuite."
Hôtel du Val de Seine,Mantes-la-Jolie,"1.7127151787281,48.9995035653404",booking.com//hotel/fr/du-val-de-seine.fr.html?label=gen173nr-1BCAEoggI46AdIM1gEaLUBiAEBmAENuAEXyAEM2AEB6AEBiAIBqAIDuALDxM2KBsACAdICJGMxZDE4N2EwLTZlNmEtNDdiOS1hMDUyLTExMTM4YjkwMjQ5MtgCBeACAQ&sid=61b454cb8fd41d94843e993cf7cd7bd2&dest_id=73&dest_type=country&group_adults=2&group_children=0&hapos=275&hpos=25&no_rooms=1&sr_order=popularity&srepoch=1632872044&srpvid=c37ba5b577a20096&ucfs=1&from=searchresults,"7,1",Bien,376 expériences vécues,"L'Hôtel du Val de Seine est situé à 30 minutes du centre de Paris. Il propose des chambres avec vue sur la Seine, une connexion Wi-Fi gratuite et un parking gratuit."
Hôtel Restaurant Sole e Monte,Cuttoli-Corticchiato,"8.90935555100441,41.988458167799",booking.com//hotel/fr/ha-tel-sole-e-monte.fr.html?label=gen173nr-1BCAEoggI46AdIM1gEaLUBiAEBmAENuAEXyAEM2AEB6AEBiAIBqAIDuALDxM2KBsACAdICJGMxZDE4N2EwLTZlNmEtNDdiOS1hMDUyLTExMTM4YjkwMjQ5MtgCBeACAQ&sid=eba586b27c93f4a7229c9c3a2b4e34dd&dest_id=73&dest_type=country&group_adults=2&group_children=0&hapos=276&hpos=1&no_rooms=1&sr_order=popularity&srepoch=1632872048&srpvid=9077a5b786c80094&ucfs=1&from=searchresults,"8,5",Très bien,296 expériences vécues,"Situé à 700 mètres d'altitude à Cuttoli-Corticchiato, l'Hôtel Restaurant Sole e Monte propose une terrasse avec vue panoramique sur les montagnes, ainsi qu'une connexion Internet gratuite à la..."
Hôtel Aix Sainte Victoire,Rousset,"5.59767633676529,43.4697007575706",booking.com//hotel/fr/mona-lisa-a-fuveau.fr.html?label=gen173nr-1BCAEoggI46AdIM1gEaLUBiAEBmAENuAEXyAEM2AEB6AEBiAIBqAIDuALDxM2KBsACAdICJGMxZDE4N2EwLTZlNmEtNDdiOS1hMDUyLTExMTM4YjkwMjQ5MtgCBeACAQ&sid=eba586b27c93f4a7229c9c3a2b4e34dd&dest_id=73&dest_type=country&group_adults=2&group_children=0&hapos=277&hpos=2&no_rooms=1&sr_order=popularity&srepoch=1632872048&srpvid=9077a5b786c80094&ucfs=1&from=searchresults,"8,1",Très bien,287 expériences vécues,"Le Hôtel Aix Sainte Victoire vous accueille dans un bâtiment à l'architecture avant-gardiste, au cœur de la paisible campagne provençale. Il propose une piscine extérieure et une terrasse."
La Grange de Marie,Nitry,"3.87714385986328,47.6657598261117",booking.com//hotel/fr/la-grange-de-marie.fr.html?label=gen173nr-1BCAEoggI46AdIM1gEaLUBiAEBmAENuAEXyAEM2AEB6AEBiAIBqAIDuALDxM2KBsACAdICJGMxZDE4N2EwLTZlNmEtNDdiOS1hMDUyLTExMTM4YjkwMjQ5MtgCBeACAQ&sid=eba586b27c93f4a7229c9c3a2b4e34dd&dest_id=73&dest_type=country&group_adults=2&group_children=0&hapos=278&hpos=3&no_rooms=1&sr_order=popularity&srepoch=1632872048&srpvid=9077a5b786c80094&ucfs=1&from=searchresults,"7,9",Bien,486 expériences vécues,L'établissement La Grange de Marie se situe à 1 km du centre de Nitry et à 19 km de Chablis. Il possède une terrasse et des chambres pourvues d'une décoration unique et d'une connexion Wi-Fi gratuite....
Campanile Bordeaux Ouest - Le Bouscat,Le Bouscat,"-0.620529055595398,44.8754838343374",booking.com//hotel/fr/campanile-bordeaux-le-bouscat.fr.html?label=gen173nr-1BCAEoggI46AdIM1gEaLUBiAEBmAENuAEXyAEM2AEB6AEBiAIBqAIDuALDxM2KBsACAdICJGMxZDE4N2EwLTZlNmEtNDdiOS1hMDUyLTExMTM4YjkwMjQ5MtgCBeACAQ&sid=eba586b27c93f4a7229c9c3a2b4e34dd&dest_id=73&dest_type=country&group_adults=2&group_children=0&hapos=279&hpos=4&no_rooms=1&sr_order=popularity&srepoch=1632872048&srpvid=9077a5b786c80094&ucfs=1&from=searchresults,"7,2",Bien,715 expériences vécues,"Le Campanile Bordeaux Ouest - Le Bouscat se trouve dans le quartier du Bouscat, à seulement 6 km du centre-ville de Bordeaux."
Résidence Prestige Odalys Front de Neige,Plagne Villages,"6.68728351593018,45.5050705206003",booking.com//hotel/fr/residence-prestige-odalys-front-de-neige.fr.html?label=gen173nr-1BCAEoggI46AdIM1gEaLUBiAEBmAENuAEXyAEM2AEB6AEBiAIBqAIDuALDxM2KBsACAdICJGMxZDE4N2EwLTZlNmEtNDdiOS1hMDUyLTExMTM4YjkwMjQ5MtgCBeACAQ&sid=eba586b27c93f4a7229c9c3a2b4e34dd&dest_id=73&dest_type=country&group_adults=2&group_children=0&hapos=280&hpos=5&no_rooms=1&sr_order=popularity&srepoch=1632872048&srpvid=9077a5b786c80094&ucfs=1&from=searchresults,"8,3",Très bien,228 expériences vécues,"La Résidence Prestige Odalys Front de Neige est située à Plagne Villages, en Auvergne-Rhône-Alpes, à proximité de l’école de ski de La Plagne Centre et des remontées mécaniques."
Hôtel La Crèche,La Chomette,"3.47291886806488,45.2312630688456",booking.com//hotel/fr/logis-la-creche.fr.html?label=gen173nr-1BCAEoggI46AdIM1gEaLUBiAEBmAENuAEXyAEM2AEB6AEBiAIBqAIDuALDxM2KBsACAdICJGMxZDE4N2EwLTZlNmEtNDdiOS1hMDUyLTExMTM4YjkwMjQ5MtgCBeACAQ&sid=eba586b27c93f4a7229c9c3a2b4e34dd&dest_id=73&dest_type=country&group_adults=2&group_children=0&hapos=281&hpos=6&no_rooms=1&sr_order=popularity&srepoch=1632872048&srpvid=9077a5b786c80094&ucfs=1&from=searchresults,"8,3",Très bien,94 expériences vécues,"Le Logis La Crèche est idéalement situé au cœur de l'Auvergne, dans la campagne entre Clermont Ferrand et Le Puy en Velay. Il offre un accueil chaleureux et convivial."
La KEFOISE,Fouquières-lès-Lens,"2.902139,50.43652",booking.com//hotel/fr/la-kefoise.fr.html?label=gen173nr-1BCAEoggI46AdIM1gEaLUBiAEBmAENuAEXyAEM2AEB6AEBiAIBqAIDuALDxM2KBsACAdICJGMxZDE4N2EwLTZlNmEtNDdiOS1hMDUyLTExMTM4YjkwMjQ5MtgCBeACAQ&sid=eba586b27c93f4a7229c9c3a2b4e34dd&dest_id=73&dest_type=country&group_adults=2&group_children=0&hapos=282&hpos=7&no_rooms=1&sr_order=popularity&srepoch=1632872048&srpvid=9077a5b786c80094&ucfs=1&from=searchresults,"9,4",Fabuleux,98 expériences vécues,"Situé à Fouquières-lès-Lens, l'établissement La KEFOISE dispose d'un restaurant, d'un salon commun, d'un jardin et d'une connexion Wi-Fi gratuite."
Chez-Marion,Merville-Franceville-Plage,"-0.200838446617126,49.284505694707",booking.com//hotel/fr/chez-marion.fr.html?label=gen173nr-1BCAEoggI46AdIM1gEaLUBiAEBmAENuAEXyAEM2AEB6AEBiAIBqAIDuALDxM2KBsACAdICJGMxZDE4N2EwLTZlNmEtNDdiOS1hMDUyLTExMTM4YjkwMjQ5MtgCBeACAQ&sid=eba586b27c93f4a7229c9c3a2b4e34dd&dest_id=73&dest_type=country&group_adults=2&group_children=0&hapos=283&hpos=8&no_rooms=1&sr_order=popularity&srepoch=1632872048&srpvid=9077a5b786c80094&ucfs=1&from=searchresults,"8,3",Très bien,709 expériences vécues,"Idéalement situé sur la côte normande, entre Ouistreham et Cabourg, l'établissement Chez-Marion propose des chambres confortables à l'atmosphère chaleureuse et moderne, à seulement 80 mètres de la..."
Hotel Le Saint Laurent,Saint-Laurent-des-Arbres,"4.69858780503273,44.0542291233394",booking.com//hotel/fr/le-saint-laurent.fr.html?label=gen173nr-1BCAEoggI46AdIM1gEaLUBiAEBmAENuAEXyAEM2AEB6AEBiAIBqAIDuALDxM2KBsACAdICJGMxZDE4N2EwLTZlNmEtNDdiOS1hMDUyLTExMTM4YjkwMjQ5MtgCBeACAQ&sid=eba586b27c93f4a7229c9c3a2b4e34dd&dest_id=73&dest_type=country&group_adults=2&group_children=0&hapos=284&hpos=9&no_rooms=1&sr_order=popularity&srepoch=1632872048&srpvid=9077a5b786c80094&ucfs=1&from=searchresults,"9,5",Exceptionnel,409 expériences vécues,"Situé entre la Provence, les Cévennes et le Lubéron, au cœur des vignobles de la région, l'Hotel Le Saint Laurent vous accueille à 15 minutes de route d'Avignon et d'Orange."
