hotel_name,location,GPS,link,rating,rating_desc,reviews,description
Lagrange Grand Bleu Vacances – Résidence Le Mas de Torreilles,Torreilles,"3.02255087660149,42.7630829636707",booking.com//hotel/fr/le-mas-de-torreilles.fr.html?label=gen173nr-1BCAEoggI46AdIM1gEaLUBiAEBmAENuAEXyAEM2AEB6AEBiAIBqAIDuALDxM2KBsACAdICJGMxZDE4N2EwLTZlNmEtNDdiOS1hMDUyLTExMTM4YjkwMjQ5MtgCBeACAQ&sid=fb3ad364d59594b6d9764babd6b08043&dest_id=73&dest_type=country&group_adults=2&group_children=0&hapos=742&hpos=17&no_rooms=1&sr_order=popularity&srepoch=1632872117&srpvid=e651a5d930a200e9&ucfs=1&from=searchresults,"7,9",Bien,80 expériences vécues,"Le Lagrange Grand Bleu Vacances - Résidence Le Mas de Torreilles est situé sur la côte catalane, à 1 km de la plage."
Le Petit Robinson,Champvert,"3.49047315476992,46.8419254540498",booking.com//hotel/fr/le-petit-robinson.fr.html?label=gen173nr-1BCAEoggI46AdIM1gEaLUBiAEBmAENuAEXyAEM2AEB6AEBiAIBqAIDuALDxM2KBsACAdICJGMxZDE4N2EwLTZlNmEtNDdiOS1hMDUyLTExMTM4YjkwMjQ5MtgCBeACAQ&sid=fb3ad364d59594b6d9764babd6b08043&dest_id=73&dest_type=country&group_adults=2&group_children=0&hapos=743&hpos=18&no_rooms=1&sr_order=popularity&srepoch=1632872117&srpvid=e651a5d930a200e9&ucfs=1&from=searchresults,"8,3",Très bien,85 expériences vécues,"Situé à Champvert, l'établissement Le Petit Robinson offre une vue sur le jardin et met gratuitement à votre disposition une connexion Wi-Fi ainsi qu'un parking privé."
Domaine la Pierre Blanche,Eygalières,"4.9859543730164,43.7698905725239",booking.com//hotel/fr/domaine-de-la-pierre-blanche.fr.html?label=gen173nr-1BCAEoggI46AdIM1gEaLUBiAEBmAENuAEXyAEM2AEB6AEBiAIBqAIDuALDxM2KBsACAdICJGMxZDE4N2EwLTZlNmEtNDdiOS1hMDUyLTExMTM4YjkwMjQ5MtgCBeACAQ&sid=fb3ad364d59594b6d9764babd6b08043&dest_id=73&dest_type=country&group_adults=2&group_children=0&hapos=744&hpos=19&no_rooms=1&sr_order=popularity&srepoch=1632872117&srpvid=e651a5d930a200e9&ucfs=1&from=searchresults,"9,3",Fabuleux,142 expériences vécues,"Situé à Eygalières, le Domaine la Pierre Blanche possède un restaurant, un bar, un salon commun et un jardin. Chaque hébergement de cet hôtel 4 étoiles offre une vue sur le jardin."
La fontaine de rocoule,Rochefort-en-Valdaine,"4.86043670000004,44.5158864",booking.com//hotel/fr/la-fontaine-de-rocoule.fr.html?label=gen173nr-1BCAEoggI46AdIM1gEaLUBiAEBmAENuAEXyAEM2AEB6AEBiAIBqAIDuALDxM2KBsACAdICJGMxZDE4N2EwLTZlNmEtNDdiOS1hMDUyLTExMTM4YjkwMjQ5MtgCBeACAQ&sid=fb3ad364d59594b6d9764babd6b08043&dest_id=73&dest_type=country&group_adults=2&group_children=0&hapos=745&hpos=20&no_rooms=1&sr_order=popularity&srepoch=1632872117&srpvid=e651a5d930a200e9&ucfs=1&from=searchresults,"9,1",Fabuleux,1 203 expériences vécues,"Dotée d’une piscine intérieure chauffée, d’une terrasse bien exposée et offrant une vue sur la montagne, La fontaine de rocoule propose des hébergements à Rochefort-en-Valdaine, en..."
Hôtellerie Beau Rivage,Condrieu,"4.75991517305374,45.4574910899079",booking.com//hotel/fr/hotellerie-beau-rivage.fr.html?label=gen173nr-1BCAEoggI46AdIM1gEaLUBiAEBmAENuAEXyAEM2AEB6AEBiAIBqAIDuALDxM2KBsACAdICJGMxZDE4N2EwLTZlNmEtNDdiOS1hMDUyLTExMTM4YjkwMjQ5MtgCBeACAQ&sid=fb3ad364d59594b6d9764babd6b08043&dest_id=73&dest_type=country&group_adults=2&group_children=0&hapos=746&hpos=21&no_rooms=1&sr_order=popularity&srepoch=1632872117&srpvid=e651a5d930a200e9&ucfs=1&from=searchresults,"8,0",Très bien,510 expériences vécues,"Située sur les rives du Rhône, l'Hôtellerie Beau Rivage, un vaste établissement à la gestion familiale, assure une atmosphère chaleureuse et conviviale, dans un cadre unique."
Terres de France - Moncontour Active Park,Moncontour,"-0.0209534168243408,46.8911040825638",booking.com//hotel/fr/moncontour-active-park-terres-de-france.fr.html?label=gen173nr-1BCAEoggI46AdIM1gEaLUBiAEBmAENuAEXyAEM2AEB6AEBiAIBqAIDuALDxM2KBsACAdICJGMxZDE4N2EwLTZlNmEtNDdiOS1hMDUyLTExMTM4YjkwMjQ5MtgCBeACAQ&sid=fb3ad364d59594b6d9764babd6b08043&dest_id=73&dest_type=country&group_adults=2&group_children=0&hapos=747&hpos=22&no_rooms=1&sr_order=popularity&srepoch=1632872117&srpvid=e651a5d930a200e9&ucfs=1&from=searchresults,"7,6",Bien,64 expériences vécues,"Le Moncontour Active Park - Terres de France vous accueille autour d'un lac de 10 hectares, où vous pourrez pratiquer diverses activités comme le canoë-kayak, la natation, le minigolf, le wakeboard,..."
Hôtel du Clos,Le Rouret,"7.00518199999999,43.675322",booking.com//hotel/fr/du-clos.fr.html?label=gen173nr-1BCAEoggI46AdIM1gEaLUBiAEBmAENuAEXyAEM2AEB6AEBiAIBqAIDuALDxM2KBsACAdICJGMxZDE4N2EwLTZlNmEtNDdiOS1hMDUyLTExMTM4YjkwMjQ5MtgCBeACAQ&sid=fb3ad364d59594b6d9764babd6b08043&dest_id=73&dest_type=country&group_adults=2&group_children=0&hapos=748&hpos=23&no_rooms=1&sr_order=popularity&srepoch=1632872117&srpvid=e651a5d930a200e9&ucfs=1&from=searchresults,"9,0",Fabuleux,117 expériences vécues,L'Hôtel du Clos occupe un bâtiment datant du XIXe siècle avec piscine extérieure au Rouret. Son parking privé est accessible sans frais.
Domaine de L'Hostreiere,Colleville-sur-Mer,"-0.854889750480652,49.3485716344531",booking.com//hotel/fr/domaine-de-l-hostreiere.fr.html?label=gen173nr-1BCAEoggI46AdIM1gEaLUBiAEBmAENuAEXyAEM2AEB6AEBiAIBqAIDuALDxM2KBsACAdICJGMxZDE4N2EwLTZlNmEtNDdiOS1hMDUyLTExMTM4YjkwMjQ5MtgCBeACAQ&sid=fb3ad364d59594b6d9764babd6b08043&dest_id=73&dest_type=country&group_adults=2&group_children=0&hapos=749&hpos=24&no_rooms=1&sr_order=popularity&srepoch=1632872117&srpvid=e651a5d930a200e9&ucfs=1&from=searchresults,"8,5",Très bien,425 expériences vécues,"Le Domaine De L'hostreiere est un hôtel 3 étoiles situé près de la plage d'Omaha au cœur du Bessin, en Normandie. Il s'étend sur un vaste terrain et offre un accueil chaleureux."
"Paese di Lava, Grand Ajaccio",Alata,"8.67060000000004,41.983695",booking.com//hotel/fr/paese-di-lava.fr.html?label=gen173nr-1BCAEoggI46AdIM1gEaLUBiAEBmAENuAEXyAEM2AEB6AEBiAIBqAIDuALDxM2KBsACAdICJGMxZDE4N2EwLTZlNmEtNDdiOS1hMDUyLTExMTM4YjkwMjQ5MtgCBeACAQ&sid=fb3ad364d59594b6d9764babd6b08043&dest_id=73&dest_type=country&group_adults=2&group_children=0&hapos=750&hpos=25&no_rooms=1&sr_order=popularity&srepoch=1632872117&srpvid=e651a5d930a200e9&ucfs=1&from=searchresults,"7,6",Bien,859 expériences vécues,"Situé sur le front de mer à Alata, le village vacances Paese di Lava, Grand Ajaccio met gratuitement à votre disposition une piscine extérieure, un court de tennis, une connexion Wi-Fi et un parking..."
Camping Le Paradis,Talmont-Saint-Hilaire,"-1.6557115316391,46.4645895776726",booking.com//hotel/fr/camping-le-paradis-talmont-saint-hilaire.fr.html?label=gen173nr-1BCAEoggI46AdIM1gEaLUBiAEBmAENuAEXyAEM2AEB6AEBiAIBqAIDuALDxM2KBsACAdICJGMxZDE4N2EwLTZlNmEtNDdiOS1hMDUyLTExMTM4YjkwMjQ5MtgCBeACAQ&sid=10c95254ec8a84a2ed9ad480becec485&dest_id=73&dest_type=country&group_adults=2&group_children=0&hapos=776&hpos=1&no_rooms=1&sr_order=popularity&srepoch=1632872124&srpvid=09c4a5ddeb750094&ucfs=1&from=searchresults,"7,3",Bien,180 expériences vécues,"Le Camping Le Paradis possède une piscine intérieure chauffée, une aire de jeux pour enfants, un bar et un restaurant à la carte."
Hôtel Les Rives,Guebwiller,"7.19619780778885,47.9194087514624",booking.com//hotel/fr/les-rives.fr.html?label=gen173nr-1BCAEoggI46AdIM1gEaLUBiAEBmAENuAEXyAEM2AEB6AEBiAIBqAIDuALDxM2KBsACAdICJGMxZDE4N2EwLTZlNmEtNDdiOS1hMDUyLTExMTM4YjkwMjQ5MtgCBeACAQ&sid=10c95254ec8a84a2ed9ad480becec485&dest_id=73&dest_type=country&group_adults=2&group_children=0&hapos=777&hpos=2&no_rooms=1&sr_order=popularity&srepoch=1632872124&srpvid=09c4a5ddeb750094&ucfs=1&from=searchresults,"8,3",Très bien,668 expériences vécues,"L'Hôtel Les Rives propose des chambres modernes et luxueuses à la décoration élégante, certaines dotées d'une terrasse privée. Il est situé sur le Domaine du Lac, où se trouve également l'Hôtel du..."
Résidence Château des Magnans by Popinns,Jausiers,"6.74297690391541,44.4173676088434",booking.com//hotel/fr/chateau-des-magnans.fr.html?label=gen173nr-1BCAEoggI46AdIM1gEaLUBiAEBmAENuAEXyAEM2AEB6AEBiAIBqAIDuALDxM2KBsACAdICJGMxZDE4N2EwLTZlNmEtNDdiOS1hMDUyLTExMTM4YjkwMjQ5MtgCBeACAQ&sid=10c95254ec8a84a2ed9ad480becec485&dest_id=73&dest_type=country&group_adults=2&group_children=0&hapos=778&hpos=3&no_rooms=1&sr_order=popularity&srepoch=1632872124&srpvid=09c4a5ddeb750094&ucfs=1&from=searchresults,"7,3",Bien,1 130 expériences vécues,"Situé à Jausiers dans la vallée de l'Ubaye, l'établissement Château des Magnans se compose de 3 bâtiments et d'un château. Il propose une piscine intérieure et une terrasse meublée."
Hotel Restaurant Cristal,Wintzenheim,"7.28547303005939,48.0739001359567",booking.com//hotel/fr/restaurant-cristal.fr.html?label=gen173nr-1BCAEoggI46AdIM1gEaLUBiAEBmAENuAEXyAEM2AEB6AEBiAIBqAIDuALDxM2KBsACAdICJGMxZDE4N2EwLTZlNmEtNDdiOS1hMDUyLTExMTM4YjkwMjQ5MtgCBeACAQ&sid=10c95254ec8a84a2ed9ad480becec485&dest_id=73&dest_type=country&group_adults=2&group_children=0&hapos=779&hpos=4&no_rooms=1&sr_order=popularity&srepoch=1632872124&srpvid=09c4a5ddeb750094&ucfs=1&from=searchresults,"7,9",Bien,425 expériences vécues,"Situé au cœur du vignoble alsacien, l'Hôtel Restaurant Cristal vous propose un hébergement à Wintzenheim, à 5 km de Colmar."
Les Chambres du Champagne Collery,Ay,"4.006608,49.054889",booking.com//hotel/fr/les-chambres-collery.fr.html?label=gen173nr-1BCAEoggI46AdIM1gEaLUBiAEBmAENuAEXyAEM2AEB6AEBiAIBqAIDuALDxM2KBsACAdICJGMxZDE4N2EwLTZlNmEtNDdiOS1hMDUyLTExMTM4YjkwMjQ5MtgCBeACAQ&sid=10c95254ec8a84a2ed9ad480becec485&dest_id=73&dest_type=country&group_adults=2&group_children=0&hapos=780&hpos=5&no_rooms=1&sr_order=popularity&srepoch=1632872124&srpvid=09c4a5ddeb750094&ucfs=1&from=searchresults,"9,4",Fabuleux,47 expériences vécues,"Situé à Ay, l'établissement Les Chambres du Champagne Collery propose un bar, un salon commun, un jardin et une connexion Wi-Fi gratuite dans l'ensemble de ses locaux."
Residence Funtanella,Sagone,"8.65560114383698,42.1123307604215",booking.com//hotel/fr/residence-funtanella.fr.html?label=gen173nr-1BCAEoggI46AdIM1gEaLUBiAEBmAENuAEXyAEM2AEB6AEBiAIBqAIDuALDxM2KBsACAdICJGMxZDE4N2EwLTZlNmEtNDdiOS1hMDUyLTExMTM4YjkwMjQ5MtgCBeACAQ&sid=10c95254ec8a84a2ed9ad480becec485&dest_id=73&dest_type=country&group_adults=2&group_children=0&hapos=781&hpos=6&no_rooms=1&sr_order=popularity&srepoch=1632872124&srpvid=09c4a5ddeb750094&ucfs=1&from=searchresults,"7,6",Bien,119 expériences vécues,"Situé à Sagone, au cœur d'un parc fleuri, le Residence Funtanella propose une connexion Wi-Fi gratuite. Les logements s'ouvrent sur une terrasse avec vue sur la mer."
B&B Le Clos du Phare,Saint-Samson-de-la-Roque,"0.43478047790984,49.427069",booking.com//hotel/fr/b-amp-b-le-clos-du-phare.fr.html?label=gen173nr-1BCAEoggI46AdIM1gEaLUBiAEBmAENuAEXyAEM2AEB6AEBiAIBqAIDuALDxM2KBsACAdICJGMxZDE4N2EwLTZlNmEtNDdiOS1hMDUyLTExMTM4YjkwMjQ5MtgCBeACAQ&sid=10c95254ec8a84a2ed9ad480becec485&dest_id=73&dest_type=country&group_adults=2&group_children=0&hapos=782&hpos=7&no_rooms=1&sr_order=popularity&srepoch=1632872124&srpvid=09c4a5ddeb750094&ucfs=1&from=searchresults,"9,2",Fabuleux,223 expériences vécues,"Le B&B Le Clos du Phare est situé à Saint-Samson-de-la-Roque, à 23 km de Honfleur."
Hotel Les Demeures de Valette,Azay-le-Brûlé,"-0.294648,46.413338",booking.com//hotel/fr/les-demeures-de-valette-azay-le-brule.fr.html?label=gen173nr-1BCAEoggI46AdIM1gEaLUBiAEBmAENuAEXyAEM2AEB6AEBiAIBqAIDuALDxM2KBsACAdICJGMxZDE4N2EwLTZlNmEtNDdiOS1hMDUyLTExMTM4YjkwMjQ5MtgCBeACAQ&sid=10c95254ec8a84a2ed9ad480becec485&dest_id=73&dest_type=country&group_adults=2&group_children=0&hapos=783&hpos=8&no_rooms=1&sr_order=popularity&srepoch=1632872124&srpvid=09c4a5ddeb750094&ucfs=1&from=searchresults,"9,3",Fabuleux,160 expériences vécues,"Situé à Azay-le-Brûlé, l'Hôtel Les Demeures de Valette bénéficie d'une piscine extérieure ouverte en saison et d'une connexion Wi-Fi gratuite accessible dans tout l'établissement."
Les Volets Bleus Alsace Vosges,Urbès,"6.95499280000001,47.8854806",booking.com//hotel/fr/les-volets-bleus-alsace-vosges.fr.html?label=gen173nr-1BCAEoggI46AdIM1gEaLUBiAEBmAENuAEXyAEM2AEB6AEBiAIBqAIDuALDxM2KBsACAdICJGMxZDE4N2EwLTZlNmEtNDdiOS1hMDUyLTExMTM4YjkwMjQ5MtgCBeACAQ&sid=10c95254ec8a84a2ed9ad480becec485&dest_id=73&dest_type=country&group_adults=2&group_children=0&hapos=784&hpos=9&no_rooms=1&sr_order=popularity&srepoch=1632872124&srpvid=09c4a5ddeb750094&ucfs=1&from=searchresults,"9,2",Fabuleux,46 expériences vécues,"L'établissement Les Volets Bleus Alsace Vosges est situé à Urbès, et propose gratuitement des VTT et une connexion Wi-Fi."
L'Echo des Montagnes,Armoy,"6.52002096176147,46.3484865531508",booking.com//hotel/fr/echo-des-montagnes.fr.html?label=gen173nr-1BCAEoggI46AdIM1gEaLUBiAEBmAENuAEXyAEM2AEB6AEBiAIBqAIDuALDxM2KBsACAdICJGMxZDE4N2EwLTZlNmEtNDdiOS1hMDUyLTExMTM4YjkwMjQ5MtgCBeACAQ&sid=10c95254ec8a84a2ed9ad480becec485&dest_id=73&dest_type=country&group_adults=2&group_children=0&hapos=785&hpos=10&no_rooms=1&sr_order=popularity&srepoch=1632872124&srpvid=09c4a5ddeb750094&ucfs=1&from=searchresults,"8,2",Très bien,363 expériences vécues,L'Echo des Montagnes Hotel se trouve à seulement 5 minutes de route de Thonon-les-Bains et d'Évian.
Kyriad Mulhouse Est - Lutterbach,Lutterbach,"7.2920948266983,47.7593560968586",booking.com//hotel/fr/kyriad-mulhouse-lutterbach.fr.html?label=gen173nr-1BCAEoggI46AdIM1gEaLUBiAEBmAENuAEXyAEM2AEB6AEBiAIBqAIDuALDxM2KBsACAdICJGMxZDE4N2EwLTZlNmEtNDdiOS1hMDUyLTExMTM4YjkwMjQ5MtgCBeACAQ&sid=10c95254ec8a84a2ed9ad480becec485&dest_id=73&dest_type=country&group_adults=2&group_children=0&hapos=786&hpos=11&no_rooms=1&sr_order=popularity&srepoch=1632872124&srpvid=09c4a5ddeb750094&ucfs=1&from=searchresults,"7,0",Bien,465 expériences vécues,"Situé à proximité de l'autoroute, l'hôtel Kyriad Mulhouse Est - Lutterbach se trouve à 10 minutes du centre-ville ainsi que de la gare."
Le Relais du Parisis,Villeparisis,"2.62490764260292,48.9488581671003",booking.com//hotel/fr/le-relais-du-parisis.fr.html?label=gen173nr-1BCAEoggI46AdIM1gEaLUBiAEBmAENuAEXyAEM2AEB6AEBiAIBqAIDuALDxM2KBsACAdICJGMxZDE4N2EwLTZlNmEtNDdiOS1hMDUyLTExMTM4YjkwMjQ5MtgCBeACAQ&sid=10c95254ec8a84a2ed9ad480becec485&dest_id=73&dest_type=country&group_adults=2&group_children=0&hapos=787&hpos=12&no_rooms=1&sr_order=popularity&srepoch=1632872124&srpvid=09c4a5ddeb750094&ucfs=1&from=searchresults,"8,2",Très bien,414 expériences vécues,"Le Relais du Parisis est situé à Villeparisis, à 20 km de l'aéroport de Paris-Charles de Gaulle et de Disneyland Paris."
Manoir La Barriere - Lot,Le Vigan,"1.44235789775848,44.7427478987754",booking.com//hotel/fr/sarl-manoir-la-barriere.fr.html?label=gen173nr-1BCAEoggI46AdIM1gEaLUBiAEBmAENuAEXyAEM2AEB6AEBiAIBqAIDuALDxM2KBsACAdICJGMxZDE4N2EwLTZlNmEtNDdiOS1hMDUyLTExMTM4YjkwMjQ5MtgCBeACAQ&sid=10c95254ec8a84a2ed9ad480becec485&dest_id=73&dest_type=country&group_adults=2&group_children=0&hapos=788&hpos=13&no_rooms=1&sr_order=popularity&srepoch=1632872124&srpvid=09c4a5ddeb750094&ucfs=1&from=searchresults,"9,3",Fabuleux,192 expériences vécues,"Située au Vigan, à 10 km du parc naturel régional des Causses du Quercy, la chambre d'hôtes Manoir La Barrière occupe une bâtisse datant du XIIIe siècle nichée dans un parc de 1 hectare."
Le Relais Du Haras - Deauville,Touques,"0.1032649,49.3413822",booking.com//hotel/fr/le-relais-du-haras.fr.html?label=gen173nr-1BCAEoggI46AdIM1gEaLUBiAEBmAENuAEXyAEM2AEB6AEBiAIBqAIDuALDxM2KBsACAdICJGMxZDE4N2EwLTZlNmEtNDdiOS1hMDUyLTExMTM4YjkwMjQ5MtgCBeACAQ&sid=10c95254ec8a84a2ed9ad480becec485&dest_id=73&dest_type=country&group_adults=2&group_children=0&hapos=789&hpos=14&no_rooms=1&sr_order=popularity&srepoch=1632872124&srpvid=09c4a5ddeb750094&ucfs=1&from=searchresults,"7,6",Bien,261 expériences vécues,"Le Relais Du Haras est un charmant hôtel situé à Touques, petit village pittoresque et fleuri situé à une minute de Deauville Toutes les chambres sont spacieuses et confortables afin de vous garantir..."
Park Hotel Bellevue,Trégastel,"-3.51463794708252,48.8293389145778",booking.com//hotel/fr/park-bellevue.fr.html?label=gen173nr-1BCAEoggI46AdIM1gEaLUBiAEBmAENuAEXyAEM2AEB6AEBiAIBqAIDuALDxM2KBsACAdICJGMxZDE4N2EwLTZlNmEtNDdiOS1hMDUyLTExMTM4YjkwMjQ5MtgCBeACAQ&sid=10c95254ec8a84a2ed9ad480becec485&dest_id=73&dest_type=country&group_adults=2&group_children=0&hapos=790&hpos=15&no_rooms=1&sr_order=popularity&srepoch=1632872124&srpvid=09c4a5ddeb750094&ucfs=1&from=searchresults,"7,9",Bien,607 expériences vécues,"L'hôtel Bellevue présente une architecture de style années 1930 et est situé à Trégastel, à 300 mètres de la côte de granit rose, avec ses plages de sable fin."
La Bastide des Pins,La Bastide,"6.65038481376541,43.7640155101131",booking.com//hotel/fr/la-pinede-la-bastide.fr.html?label=gen173nr-1BCAEoggI46AdIM1gEaLUBiAEBmAENuAEXyAEM2AEB6AEBiAIBqAIDuALDxM2KBsACAdICJGMxZDE4N2EwLTZlNmEtNDdiOS1hMDUyLTExMTM4YjkwMjQ5MtgCBeACAQ&sid=10c95254ec8a84a2ed9ad480becec485&dest_id=73&dest_type=country&group_adults=2&group_children=0&hapos=791&hpos=16&no_rooms=1&sr_order=popularity&srepoch=1632872124&srpvid=09c4a5ddeb750094&ucfs=1&from=searchresults,"8,8",Superbe,176 expériences vécues,"Située à La Bastide au cœur d'une pinède, l'établissement La Bastide des Pins propose des hébergements avec petit-déjeuner, un jardin et une vue sur les montagnes."
le Santa Maria,Santa-Maria-Siché,"8.981436,41.877965",booking.com//hotel/fr/le-santa-maria.fr.html?label=gen173nr-1BCAEoggI46AdIM1gEaLUBiAEBmAENuAEXyAEM2AEB6AEBiAIBqAIDuALDxM2KBsACAdICJGMxZDE4N2EwLTZlNmEtNDdiOS1hMDUyLTExMTM4YjkwMjQ5MtgCBeACAQ&sid=10c95254ec8a84a2ed9ad480becec485&dest_id=73&dest_type=country&group_adults=2&group_children=0&hapos=792&hpos=17&no_rooms=1&sr_order=popularity&srepoch=1632872124&srpvid=09c4a5ddeb750094&ucfs=1&from=searchresults,"8,0",Très bien,223 expériences vécues,"Situé à Santa-Maria-Siché, l'établissement le Santa Maria dispose d'une terrasse. Doté d'un bar, cet hôtel 2 étoiles propose des chambres climatisées avec connexion Wi-Fi gratuite."
Hotel-Restaurant La Lauzétane,Le Lauzet-Ubaye,"6.43666595220566,44.4264956647769",booking.com//hotel/fr/la-lauzetane.fr.html?label=gen173nr-1BCAEoggI46AdIM1gEaLUBiAEBmAENuAEXyAEM2AEB6AEBiAIBqAIDuALDxM2KBsACAdICJGMxZDE4N2EwLTZlNmEtNDdiOS1hMDUyLTExMTM4YjkwMjQ5MtgCBeACAQ&sid=10c95254ec8a84a2ed9ad480becec485&dest_id=73&dest_type=country&group_adults=2&group_children=0&hapos=793&hpos=18&no_rooms=1&sr_order=popularity&srepoch=1632872124&srpvid=09c4a5ddeb750094&ucfs=1&from=searchresults,"7,2",Bien,274 expériences vécues,"L’Hotel La Lauzétane est situé à 900 mètres d'altitude dans la vallée de l'Ubaye, à 20 km de Barcelonnette, à 25 km de Savines-le-Lac et à 45 km de Gap."
Au Bien Etre,Villecroze,"6.28712475299835,43.5620203608436",booking.com//hotel/fr/au-bien-etre.fr.html?label=gen173nr-1BCAEoggI46AdIM1gEaLUBiAEBmAENuAEXyAEM2AEB6AEBiAIBqAIDuALDxM2KBsACAdICJGMxZDE4N2EwLTZlNmEtNDdiOS1hMDUyLTExMTM4YjkwMjQ5MtgCBeACAQ&sid=10c95254ec8a84a2ed9ad480becec485&dest_id=73&dest_type=country&group_adults=2&group_children=0&hapos=794&hpos=19&no_rooms=1&sr_order=popularity&srepoch=1632872124&srpvid=09c4a5ddeb750094&ucfs=1&from=searchresults,"8,6",Superbe,211 expériences vécues,"Cet hôtel de campagne se trouve à 3,5 km du village de Villecroze, en plein cœur de la Provence."
"Pounette, appartement T3 centre / thermes Luxeuil",Luxeuil-les-Bains,"6.3790449,47.8177073",booking.com//hotel/fr/pounette-appartement-t3-centre-47-thermes-luxeuil.fr.html?label=gen173nr-1BCAEoggI46AdIM1gEaLUBiAEBmAENuAEXyAEM2AEB6AEBiAIBqAIDuALDxM2KBsACAdICJGMxZDE4N2EwLTZlNmEtNDdiOS1hMDUyLTExMTM4YjkwMjQ5MtgCBeACAQ&sid=10c95254ec8a84a2ed9ad480becec485&dest_id=73&dest_type=country&group_adults=2&group_children=0&hapos=795&hpos=20&no_rooms=1&sr_order=popularity&srepoch=1632872124&srpvid=09c4a5ddeb750094&ucfs=1&from=searchresults,"9,0",Fabuleux,5 expériences vécues,"Le Pounette, appartement T3 centre / thermes Luxeuil est situé à Luxeuil-les-Bains. Offrant une vue sur le jardin, il se trouve à 46 km de Montbéliard."
Le Neoulous,Le Boulou,"2.82195746898651,42.5200946018186",booking.com//hotel/fr/le-neoulous.fr.html?label=gen173nr-1BCAEoggI46AdIM1gEaLUBiAEBmAENuAEXyAEM2AEB6AEBiAIBqAIDuALDxM2KBsACAdICJGMxZDE4N2EwLTZlNmEtNDdiOS1hMDUyLTExMTM4YjkwMjQ5MtgCBeACAQ&sid=10c95254ec8a84a2ed9ad480becec485&dest_id=73&dest_type=country&group_adults=2&group_children=0&hapos=796&hpos=21&no_rooms=1&sr_order=popularity&srepoch=1632872124&srpvid=09c4a5ddeb750094&ucfs=1&from=searchresults,"7,3",Bien,976 expériences vécues,"Idéalement situé au pied du massif des Albères et offrant une vue panoramique sur les pics du Néoulous et du Canigou, le Neoulous constitue l'endroit idéal pour passer un séjour de détente à la..."
Pierre & Vacances Hotel du Golf de Pont Royal en Provence,Mallemort,"5.19618988037109,43.707097142731",booking.com//hotel/fr/latitudes-pont-royal-du-golf.fr.html?label=gen173nr-1BCAEoggI46AdIM1gEaLUBiAEBmAENuAEXyAEM2AEB6AEBiAIBqAIDuALDxM2KBsACAdICJGMxZDE4N2EwLTZlNmEtNDdiOS1hMDUyLTExMTM4YjkwMjQ5MtgCBeACAQ&sid=10c95254ec8a84a2ed9ad480becec485&dest_id=73&dest_type=country&group_adults=2&group_children=0&hapos=797&hpos=22&no_rooms=1&sr_order=popularity&srepoch=1632872124&srpvid=09c4a5ddeb750094&ucfs=1&from=searchresults,"8,0",Très bien,141 expériences vécues,"Situé dans un village provençal entre Aix-en-Provence et Avignon, le Pierre & Vacances Hotel du Golf de Pont Royal en Provence dispose de piscines extérieures, d'un court de tennis et d'une connexion..."
Quintessia Resort et Spa,Orvault,"-1.58943682909012,47.2589739030312",booking.com//hotel/fr/le-domaine-d-orvault.fr.html?label=gen173nr-1BCAEoggI46AdIM1gEaLUBiAEBmAENuAEXyAEM2AEB6AEBiAIBqAIDuALDxM2KBsACAdICJGMxZDE4N2EwLTZlNmEtNDdiOS1hMDUyLTExMTM4YjkwMjQ5MtgCBeACAQ&sid=10c95254ec8a84a2ed9ad480becec485&dest_id=73&dest_type=country&group_adults=2&group_children=0&hapos=798&hpos=23&no_rooms=1&sr_order=popularity&srepoch=1632872124&srpvid=09c4a5ddeb750094&ucfs=1&from=searchresults,"6,9",Note,381 expériences vécues,"Doté d'un jardin et d'une terrasse, le Quintessia Resort et Spa est situé à Orvault, aux portes de Nantes."
"À Chablis - La Maison d'Alienor, Chambres d'hôtes",Chablis,"3.80089402198792,47.8155320982852",booking.com//hotel/fr/ga-r-tes-et-chambres-d-ha-tes-du-bergerand-s.fr.html?label=gen173nr-1BCAEoggI46AdIM1gEaLUBiAEBmAENuAEXyAEM2AEB6AEBiAIBqAIDuALDxM2KBsACAdICJGMxZDE4N2EwLTZlNmEtNDdiOS1hMDUyLTExMTM4YjkwMjQ5MtgCBeACAQ&sid=10c95254ec8a84a2ed9ad480becec485&dest_id=73&dest_type=country&group_adults=2&group_children=0&hapos=799&hpos=24&no_rooms=1&sr_order=popularity&srepoch=1632872124&srpvid=09c4a5ddeb750094&ucfs=1&from=searchresults,"7,9",Bien,399 expériences vécues,"Située au cœur de Chablis, sur les rives du Serein, l'établissement La Maison d'Alienor - Maison et Chambres d'Hôtes occupe un ancien relais de poste qui a accueilli temporairement des rois et des..."
"Manoir de la Roche Torin, The Originals Relais (Relais du Silence)",Courtils,"-1.42506182190118,48.6372729833596",booking.com//hotel/fr/le-manoir-de-la-roche-torin.fr.html?label=gen173nr-1BCAEoggI46AdIM1gEaLUBiAEBmAENuAEXyAEM2AEB6AEBiAIBqAIDuALDxM2KBsACAdICJGMxZDE4N2EwLTZlNmEtNDdiOS1hMDUyLTExMTM4YjkwMjQ5MtgCBeACAQ&sid=10c95254ec8a84a2ed9ad480becec485&dest_id=73&dest_type=country&group_adults=2&group_children=0&hapos=800&hpos=25&no_rooms=1&sr_order=popularity&srepoch=1632872124&srpvid=09c4a5ddeb750094&ucfs=1&from=searchresults,"7,7",Bien,193 expériences vécues,"Situé à Courtils, à 10 km du Mont-Saint-Michel, le Manoir de la Roche Torin, The Originals Relais (Relais du Silence) Offrant une vue sur l'abbaye du Mont-Saint-Michel, il vous propose une connexion..."
La Passerelle de Pont-Aven,Pont-Aven,"-3.747282,47.853314",booking.com//hotel/fr/la-passerelle-de-pont-aven.fr.html?label=gen173nr-1BCAEoggI46AdIM1gEaLUBiAEBmAENuAEXyAEM2AEB6AEBiAIBqAIDuALDxM2KBsACAdICJGMxZDE4N2EwLTZlNmEtNDdiOS1hMDUyLTExMTM4YjkwMjQ5MtgCBeACAQ&sid=15bcaeffe452a8039f8f9c53e459fc4a&dest_id=73&dest_type=country&group_adults=2&group_children=0&hapos=801&hpos=1&no_rooms=1&sr_order=popularity&srepoch=1632872128&srpvid=7ae4a5df91ae007b&ucfs=1&from=searchresults,"9,4",Fabuleux,285 expériences vécues,"Dotée d’un jardin, d’une terrasse et offrant une vue sur la rivière, La Passerelle de Pont-Aven propose des hébergements avec une connexion Wi-Fi gratuite, notamment des chambres familiales, à..."
Hôtel restaurant U.Pozzu,Sisco,"9.48846395857322,42.8080345575221",booking.com//hotel/fr/restaurant-upozzu.fr.html?label=gen173nr-1BCAEoggI46AdIM1gEaLUBiAEBmAENuAEXyAEM2AEB6AEBiAIBqAIDuALDxM2KBsACAdICJGMxZDE4N2EwLTZlNmEtNDdiOS1hMDUyLTExMTM4YjkwMjQ5MtgCBeACAQ&sid=15bcaeffe452a8039f8f9c53e459fc4a&dest_id=73&dest_type=country&group_adults=2&group_children=0&hapos=802&hpos=2&no_rooms=1&sr_order=popularity&srepoch=1632872128&srpvid=7ae4a5df91ae007b&ucfs=1&from=searchresults,"7,4",Bien,221 expériences vécues,"Situé à Sisco, à 90 mètres de la plage Marine de Sisco, l'Hôtel restaurant U.Pozzu propose un bar, un parking privé gratuit, un salon commun et un jardin."
Hôtel de la Cloche SP,Vitry-le-François,"4.58469,48.724925",booking.com//hotel/fr/de-la-cloche-sp-vitry-le-francois.fr.html?label=gen173nr-1BCAEoggI46AdIM1gEaLUBiAEBmAENuAEXyAEM2AEB6AEBiAIBqAIDuALDxM2KBsACAdICJGMxZDE4N2EwLTZlNmEtNDdiOS1hMDUyLTExMTM4YjkwMjQ5MtgCBeACAQ&sid=15bcaeffe452a8039f8f9c53e459fc4a&dest_id=73&dest_type=country&group_adults=2&group_children=0&hapos=803&hpos=3&no_rooms=1&sr_order=popularity&srepoch=1632872128&srpvid=7ae4a5df91ae007b&ucfs=1&from=searchresults,"7,0",Bien,158 expériences vécues,"Situé à Vitry-le-François, l'Hôtel de la Cloche SP possède un restaurant, un bar, un jardin et un casino. Cet hôtel 2 étoiles assure des services d'étage et de concierge."
